label,year,reporter_info,status,case_categories,jurisdictions,principal_laws,summary,at_issue,case_documents,url
"Elliott-Smith v. Secretary of State for Business, Energy and Industrial Strategy et al.",2020,,Decided,"Suits against governments, GHG emissions reduction and trading, Other","United Kingdom, England and Wales, High Court of Justice","United Kingdom, UK Emissions Trading Scheme, United Kingdom, Climate Change Act 2008","In December 2020, Georgia Elliott-Smith, a waste industry expert and environmental consultant, won permission to challenge two aspects of the UK Emissions Trading Scheme (UK ETS), which will replace the EU Emissions Trading Scheme in January 2021. Elliott-Smith alleges that the total emissions cap is too high to meet short and medium-term obligations under the Paris Agreement, and that the emissions cap unlawfully omits municipal waste incinerator emissions. She further alleges that the Climate Change Act of 2008 sets the purpose of the UK ETS as reducing emissions, whereas the government set the emissions cap for the improper purpose of easing the UK's exit from the EU.",Whether the UK Emissions Trading Scheme sets an improperly high emissions cap and unlawfully excludes incinerator emissions,"https://climatecasechart.com/wp-content/uploads/non-us-case-documents/2021/20210615_12885_judgment.pdf, https://climatecasechart.com/wp-content/uploads/non-us-case-documents/2020/20200805_12885_petition.pdf, https://climatecasechart.com/wp-content/uploads/non-us-case-documents/2021/20210331_12885_points-of-claim-1.pdf, https://climatecasechart.com/wp-content/uploads/non-us-case-documents/2021/20210323_12885_points-of-claim-1.pdf, https://climatecasechart.com/wp-content/uploads/non-us-case-documents/2021/20210615_12885_judgment-1.pdf",https://climatecasechart.com/non-us-case/elliott-smith-v-secretary-of-state-for-business-energy-and-industrial-strategy-et-al
A Sud et al. v. Italy,2021,,Pending,"Suits against governments, GHG emissions reduction and trading, Other","Italy, Civil Court of Rome","International Law, UNFCCC, Paris Agreement, International Law, Aarhus Convention on Access to Environmental Information, Italy, Civil Code Article 2043, International Law, European Convention on Human Rights","On June 5, 2021, environmental justice NGO A Sud and more than 200 plaintiffs filed suit alleging that the Italian government, by failing to take actions necessary to meet Paris Agreement temperature targets, is violating fundamental rights, including the right to a stable and safe climate. The action, part of a campaign called Giudizio Universale (The Last Judgment), seeks a declaration that the government's inaction is contributing to the climate emergency and a court order to reduce emissions 92% by 2030 compared to 1990 levels. According to an executive summary of the claim released by the plaintiffs, the government's climate obligations stem from the Paris Agreement, EU regulations, and IPCC reports. The human right to a stable and safe climate is based on guarantees in Article 6 of the Treaty of the European Union (guarantee of fundamental rights), and Articles 2 (right to life) and 8 (right to privacy) of the European Convention on Human Rights, among others. These rights violations give rise to non-contractual liability of the Italian government under Article 2043 of the Italian Civil Code.",Whether the Italian government is violating fundamental rights through its inaction on the climate emergency,"https://climatecasechart.com/wp-content/uploads/non-us-case-documents/2021/20210605_14016_na.pdf, https://climatecasechart.com/wp-content/uploads/non-us-case-documents/2021/20210605_14016_petition.pdf, https://climatecasechart.com/wp-content/uploads/non-us-case-documents/2021/20210605_14016_petition-2.pdf, https://climatecasechart.com/wp-content/uploads/non-us-case-documents/2021/20210520_14016_na.pdf, https://climatecasechart.com/wp-content/uploads/non-us-case-documents/2022/20220519_14016_na.pdf, https://climatecasechart.com/wp-content/uploads/non-us-case-documents/2024/20240226_14016_judgment.pdf",https://climatecasechart.com/non-us-case/a-sud-et-al-v-italy
"Steinmetz, et al. v. Germany II",2023,1 BvR 2047/23,Pending,,"Germany, Higher Administrative Court of Bavaria, Germany, Federal Constitutional Court","Germany, Constitution, Germany, Federal Climate Protection Act of 2019 (KSG)","On October 24, 2023, the German environmental organization Deutsche Umwelthilfe (DUH, Environmental Action Germany), together with a group of German minors and young adults, filed a new constitutional complaint before the Federal Constitutional Court (FCC) against the Federal Government.",Whether Germany's climate protection program violates fundamental rights as it is not ambitious enough,https://climatecasechart.com/wp-content/uploads/non-us-case-documents/2023/20231024_1-BvR-204723_complaint-1.pdf,https://climatecasechart.com/non-us-case/steinmetz-et-al-v-germany-ii
Cementownia “Warta” S.A. v. Commission of the European Communities,2007,"Court of First Instance, T-198/07",Decided,,"European Union, General Court (known as Court of First Instance before 2010)","European Union, Secondary Law, Directives, 2003/87/EC",Applicants in the above actions challenged the Commission of the European Communities' decision rejecting the Polish Phase II national allocation plan (NAP) for the allocation of GHG emission allowances. The Court dismissed all actions as inadmissible because the Commission's decision did not directly and individually affect the Applicants.,Whether the court should annul the Commission's decision rejecting part of the Polish Phase II NAP.,"https://climatecasechart.com/wp-content/uploads/non-us-case-documents/2007/20070605_Court-of-First-Instance-T-19807_application.pdf, https://climatecasechart.com/wp-content/uploads/non-us-case-documents/2008/20080923_Court-of-First-Instance-T-19807_order.pdf",https://climatecasechart.com/non-us-case/cementownia-warta-sa-v-commission-of-the-european-communities
Institute of Amazonian Studies v. Brazil,2020,Ação Civil Pública Nº 5048951-39.2020.4.04.7000,Pending,"Suits against governments, GHG emissions reduction and trading, Other, Suits against governments, Human Rights, Right to a healthy environment, Suits against governments, Protecting biodiveristy and ecosystems","Brazil, Paraná (PR), Paraná Federal Court","Brazil, Action Plan for Prevention and Control of the Legal Amazon Deforestation (PPCDAm), Brazil, National Climate Change Policy (Law No. 12187 of 2009), Brazil, Constitution of 1988","On October 8, 2020, the Institute of Amazonian Studies (Instituto de Estudos Amazônicos - IEA) filed a Public Civil Action (class action) against the Federal Government of Brazil, seeking recognition of a fundamental right to a stable climate for present and future generations under the Brazilian Constitution, and seeking an order to compel the federal government to comply with national climate law. Plaintiffs allege that the federal government has failed to comply with its own action plans to prevent deforestation and mitigate and adapt to climate change, violating national law and fundamental rights. Plaintiffs assert that the government has failed to meet the Brazilian emissions targets set out in the Climate Change National Policy Act, a binding act passed by the Brazilian legislature. In order to meet these targets, the federal government issued a decree setting out specific action plans for preventing and controlling deforestation in various Brazilian biomes, as well as outlining sectoral plans for climate change mitigation and adaptation. A key part of this decree is the Action Plan for Prevention and Control of Deforestation in Legal Amazon (PPCDAm). By failing to meet critical targets in the PPCDAm and emissions targets, plaintiffs allege that the government is violating fundamental rights and national law. Plaintiffs seek an order to compel the federal government to comply with its existing policies, to reforest an area equivalent to what was deforested beyond the statutory limit, and to allocate sufficient budgetary resources for this purpose.",Whether the Brazilian Constitution guarantees a fundamental right to a stable climate and whether the Brazilian government may be compelled to meet emission and deforestation reduction goals,"https://climatecasechart.com/wp-content/uploads/non-us-case-documents/2020/20201008_Acao-Civil-Publica-No-5048951-39.2020.4.04.7000_complaint-1.pdf, https://climatecasechart.com/wp-content/uploads/non-us-case-documents/2020/20201008_Acao-Civil-Publica-No-5048951-39.2020.4.04.7000_complaint-2.pdf, https://climatecasechart.com/wp-content/uploads/non-us-case-documents/2020/20200924_Acao-Civil-Publica-No-5048951-39.2020.4.04.7000_na-1.pdf, https://climatecasechart.com/wp-content/uploads/non-us-case-documents/2021/20210816_Acao-Civil-Publica-No-5048951-39.2020.4.04.7000_appeal-1.pdf, https://climatecasechart.com/wp-content/uploads/non-us-case-documents/2021/20210820_Acao-Civil-Publica-No-5048951-39.2020.4.04.7000_decision-1.pdf, https://climatecasechart.com/wp-content/uploads/non-us-case-documents/2021/20210820_Acao-Civil-Publica-No-5048951-39.2020.4.04.7000_na-1.pdf, https://climatecasechart.com/wp-content/uploads/non-us-case-documents/2021/20211207_Acao-Civil-Publica-No-5048951-39.2020.4.04.7000_judgment-1.pdf, https://climatecasechart.com/wp-content/uploads/non-us-case-documents/2022/20220329_Acao-Civil-Publica-No-5048951-39.2020.4.04.7000_na-1.pdf, https://climatecasechart.com/wp-content/uploads/non-us-case-documents/2022/20220722_Acao-Civil-Publica-No-5048951-39.2020.4.04.7000_na.pdf",https://climatecasechart.com/non-us-case/institute-of-amazonian-studies-v-brazil
"Iberdrola S.A. and Others, Judgement of the Court of 17 of Oct. 2013",,[2013] Case C-566/11,Denied,"Suits against governments, GHG emissions reduction and trading, EU ETS","European Union, European Court of Justice","European Union, Secondary Law, Directives, 2003/87/EC","Spain amended its system for purchasing wholesale electricity by reducing the remuneration of electricity production to remove unfair windfalls for electricity producers caused by issuance of allowances for free under the EU Emissions Trading System (ETS). Electricity producers challenged the measure asserting that it was contrary to Directive 2003/87/EZ (establishing EU ETS) because it effectively made emissions allowances costly. The European Court of Justice rejected the electricity producers arguments, finding instead that the Directive does not preclude remuneration for electricity producers for the purpose of counterbalancing windfall profits resulting from the allocation of emission allowances. In addition, the court found that the legislative measure does not remove  the incentive to reduce greenhouse gas emissions and was thus not inconsistent with the goals of the Directive.",Challenge law remumerating profits from energy producers,https://climatecasechart.com/wp-content/uploads/non-us-case-documents/2013/20131017_2013-Case-C-56611_judgment-1.pdf,https://climatecasechart.com/non-us-case/iberdrola-sa-et-al-judgement-of-the-court-of-17-of-oct-2013
ACCC Carbon Neutral Claims,2023,,Pending,"Suits against governments, GHG emissions reduction and trading, Other","Australia, Australian Competition and Consumer Commission","Australia, Australian Consumer Law","The Australia Institute, a public policy think tank based in Canberra, Australia, alleged in a complaint that the Climate Active trademark program is misleading and deceptive under Australian Consumer Law and referred the program to the Australian Competition and Consumer Commission (ACCC) for investigation.",Whether the Climate Active certification program is misleading consumers according to the Australian Consumer Law.,https://climatecasechart.com/wp-content/uploads/non-us-case-documents/2023/20230213_19314_complaint.pdf,https://climatecasechart.com/non-us-case/accc-carbon-neutral-claims
"In re Cales de Llierca, S.A., Judgment No. 7167/2008 of Dec. 2, 2008",,Appeal No. 259/2005,Granted,"Suits against governments, GHG emissions reduction and trading, EU ETS","Spain, Supreme Court of Spain, Administrative Litigation Division","Spain, Royal Decree Law 1866/2004 of September 6","Cales de Llierca, S.A., brought suit against the Council of Ministers of Spain challenging their decision of January 21, 2005 approving the individual assignment of emissions credits to its lime processing facility for the 2005-2007 period.  Cales de Llierca argued the assignment of credits was done in violation of provisions in Royal Decree 1866/2004 which required consideration of increased production capacity prior to a certain date in order to determine acceptable emissions levels and the corresponding assignment of credits.   The court found in favor of Cales de Llierca and ordered the Council to conduct a new assignment of credits, holding that the administrative record did not sustain the Council’s conclusion regarding the facility’s production capacity and that it had misapplied the methodologies required by applicable laws in reaching its conclusion.",Challenge to individual assignment of emissions,https://climatecasechart.com/wp-content/uploads/non-us-case-documents/2008/20081202_Appeal-No.-2592005_judgment.pdf,https://climatecasechart.com/non-us-case/in-re-cales-de-llierca-sa-judgment-no-71672008-of-dec-2-2008
R (oao Friends of the Earth) v. Secretary of State for Business Energy and Industrial Strategy,2022,[2022] EWHC 1841 (Admin),Decided,"Suits against governments, GHG emissions reduction and trading, Other","United Kingdom, England and Wales, High Court of Justice","United Kingdom, Climate Change Act 2008","On January 12, 2022, Friends of the Earth (FoE) filed a claim for judicial review against the SoS, in relation to the Net Zero Strategy (“NZS”)  and the Heat and Buildings Strategy (HBS; the Government’s strategy to decarbonize homes and buildings) arguing that both strategies were unlawfully adopted. The NZS is the Government’s economy-wide decarbonization strategy. The CCA was the first piece of legislation anywhere in the world to set domestically enforceable carbon reduction targets. Sections 13 and 14 of the CCA require the SoS to produce policies which will enable upcoming carbon budgets set under the CCA to be met (s.13), and to report on those policies to parliament (s.14).","Whether the SoS’s adoption of the Net Zero Strategy did not discharge his duties under the Climate Change Act 2008, and whether the adoption of the Heat and Buildings Strategy has meant that the SoS has breached the Equality Act 2010 (FoE’s Claim). Whether the SoS’s adoption of the Net Zero Strategy did not discharge his duties under the Climate Change Act 2008, and whether these duties had been interpreted compatibly with human rights obligations (ClientEarth’s and the Good Law Project’s claims).","https://climatecasechart.com/wp-content/uploads/non-us-case-documents/2022/20220302_2022-EWHC-1841-Admin_press-release-1.pdf, https://climatecasechart.com/wp-content/uploads/non-us-case-documents/2022/20220113_2022-EWHC-1841-Admin_press-release-1.pdf, https://climatecasechart.com/wp-content/uploads/non-us-case-documents/2022/20220201_2022-EWHC-1841-Admin_press-release-1.pdf, https://climatecasechart.com/wp-content/uploads/non-us-case-documents/2022/20220302_2022-EWHC-1841-Admin_na-1.pdf, https://climatecasechart.com/wp-content/uploads/non-us-case-documents/2022/20220212_2022-EWHC-1841-Admin_press-release-1.pdf, https://climatecasechart.com/wp-content/uploads/non-us-case-documents/2022/20220718_2022-EWHC-1841-Admin_judgment-1.docx, https://climatecasechart.com/wp-content/uploads/non-us-case-documents/2022/20220718_2022-EWHC-1841-Admin_press-release-1.pdf, https://climatecasechart.com/wp-content/uploads/non-us-case-documents/2022/20220301_2022-EWHC-1841-Admin_order-4.pdf, https://climatecasechart.com/wp-content/uploads/non-us-case-documents/2022/20220301_2022-EWHC-1841-Admin_order-1.pdf, https://climatecasechart.com/wp-content/uploads/non-us-case-documents/2022/20220301_2022-EWHC-1841-Admin_order-2.pdf, https://climatecasechart.com/wp-content/uploads/non-us-case-documents/2022/20220518_2022-EWHC-1841-Admin_application-1.pdf, https://climatecasechart.com/wp-content/uploads/non-us-case-documents/2022/20220718_2022-EWHC-1841-Admin_judgment-3.pdf, https://climatecasechart.com/wp-content/uploads/non-us-case-documents/2022/20220719_2022-EWHC-1841-Admin_press-release-1.pdf, https://climatecasechart.com/wp-content/uploads/non-us-case-documents/2022/20220719_2022-EWHC-1841-Admin_order.pdf",https://climatecasechart.com/non-us-case/r-oao-friends-of-the-earth-v-secretary-of-state-for-business-energy-and-industrial-strategy
Federal Republic of Germany v. Commission of the European Communities,,[2007] Case T-374/04,Annulment granted,"Suits against governments, GHG emissions reduction and trading, EU ETS","European Union, General Court (known as Court of First Instance before 2010)","European Union, Secondary Law, Directives, 2003/87/EC","European Court concluded, inter alia, that while Member States have a degree of freedom in establishing a scheme for greenhouse gas emission allowance trading within the Community, the Commission is authorized to verify that the adopted measures are consistent with Directive 2003/87.  Furthermore, individual allocation of allowances for greenhouse gas emissions and the national allocation plan (NAP) are open to amendment under Article 11(1) of Directive 2003/87.  The Court also noted that ex-post adjustments of allowances allocated by a NAP do not harm the principal objective of Directive 2003/87.",Germany sought annulment of Commission decision rejecting ex post adjustments of the National Allocation Plan (NAP),https://climatecasechart.com/wp-content/uploads/non-us-case-documents/2007/20071107_2007-Case-T-37404_judgment.pdf,https://climatecasechart.com/non-us-case/federal-republic-of-germany-v-commission-of-the-european-communities
"In re Cerámica General Castaños, S.A., Judgment No. 7168/2008 of Dec. 3, 2008",,Appeal No. 322/2005,Remanded,"Suits against governments, GHG emissions reduction and trading, EU ETS","Spain, Supreme Court of Spain, Administrative Litigation Division","Spain, Royal Decree Law 1866/2004 of September 6","Cerámica General Castaños, S.A., brought suit against the decision of the Council of Ministers of Spain of January 21, 2005 approving the assignment of emission credits to its facility in Bailen for the 2005-2007 term at 6,666 annual tons of CO2.  The Court found in favor of Cerámica, inasmuch as the Administration had not taken into account the proven increase in production capacity that was expected from the facility’s new wing. According to the Court, Royal Decree 1866/2004 of September 6, 2004 required consideration of increased production capacity prior to a certain date in order to determine acceptable emissions levels and the corresponding assignment of credits.  However, the Court found there was insufficient proof in the record to sustain Cerámica’s argument for an increase to 7,725 annual tons of CO2.  Accordingly, the Court annulled the individual assignment of emissions credits and ordered that a new calculation take place in harmony with its findings.","Individual assignment annulled, new calculation ordered",https://climatecasechart.com/wp-content/uploads/non-us-case-documents/2008/20081203_Appeal-No.-3222005_judgment.pdf,https://climatecasechart.com/non-us-case/in-re-ceramica-general-castanos-sa-judgment-no-71682008-of-dec-3-2008
"In re Minera Catalana Aragonesa, S.A., Judgment No. 7449/2008 of Nov. 18, 2008",,Appeal No. 332/2006,Granted,"Suits against governments, GHG emissions reduction and trading, EU ETS","Spain, Supreme Court of Spain, Administrative Litigation Division","Spain, Royal Decree Law 1/2005 of March 9th","Minera Catalana Aragonesa, S.A. brought suit against the General Government Administration of Spain (Ministry of the Environment) challenging the decision of the Council of Ministers of Spain of July 14, 2006, approving the individual assignment of emissions credits to its ceramics facility in the region of Onda.  Minera Catalana had requested the exclusion of the types of processes employed at its facility (the drying of barbotine, a mixture of clay and water, by atomization) in the definition of “combustion facilities” under Law 1/2005 of March 9th, as modified by Royal Decree 5/2005 of March 11th, which regulates the market for GHG emissions trading in Spain.  The court found in Minera Catalana’s favor, adopting its argument that because its combustion processes were not used for energy production they could not be included in the scope of Law 1/2005, and declared the decision of the Council of Ministers in this respect null and void.",Challenging to individual assignment of emissions allowances,https://climatecasechart.com/wp-content/uploads/non-us-case-documents/2008/20081118_Appeal-No.-3322006_judgment.pdf,https://climatecasechart.com/non-us-case/minera-catalana-aragonesa-sa-judgment-no-74492008-of-nov-18-2008
Bitter v. Germany,2015,Directive 2003/87/EC,Decided,"Suits against governments, GHG emissions reduction and trading, EU ETS","European Union, European Court of Justice","European Union, Secondary Law, Directives, 2003/87/EC","Claimant challenged the European Union Emissions Trading Scheme's (EU ETS) excess emissions penalty, imposed on operators that have not surrendered sufficient emissions allowances.  The European Court of Justice upheld the penalty.","Plaintiff challenged validity, under EU Emissions Trade Scheme, of 100-euro penalty per ton of carbon dioxide emitted for which the operator has not surrendered allowances.",https://climatecasechart.com/wp-content/uploads/non-us-case-documents/2015/20150917_Directive-200387EC_order-1.pdf,https://climatecasechart.com/non-us-case/bitter-v-germany
"Re Emission Quotas: Decision No. 2010-622 DC of Dec. 28, 2010",,N° 2010-622 DC,Denied,"Suits against governments, GHG emissions reduction and trading, EU ETS","France, Constitutional Council","France, Article 64 of the Finance Law of 2011","Article 64 of the finance law of 2011 provides that companies will have to purchase their greenhouse gas emissions quotas for 2011 whereas quotas were distributed free of charge in 2010.   Some of the companies have still not received their quotas, even though they carried out activities in 2010, and as a result challenged the validity of the law as violating the principle of equality between companies.  However the Constitutional Council upholds the validity of the article as the quota purchase will only apply for 2011 and 2012.",Challenge to assignment of quotas,https://climatecasechart.com/wp-content/uploads/non-us-case-documents/2010/20101228_N°-2010-622-DC_decision.pdf,https://climatecasechart.com/non-us-case/re-emission-quotas-decision-no-2010-622-dc-of-dec-28-2010
Greenpeace v. Instituto Nacional de Ecología y Cambio Climático and Others,2021,,Decided,"Suits against governments, GHG emissions reduction and trading, Other","Mexico, Eleventh Collegiate Court of the First Circuit in Administrative Matters","Mexico, General Law on Climate Change, Mexico, Constitution","On March 9, 2021, Greenpeace filed an amparo, an emergency proceeding, against the National Institute of Ecology and Climate Change, the Inter-secretarial Commission on Climate Change, the Secretariat of Environment and Natural Resources, the Council of Climate Change, and the Mexican President, challenging Mexico’s revised Nationally Determined Contributions (NDC). The NGO argued that the NDC failed to respect the principle of non-regression in human rights law. In its original 2015 NDC, Mexico committed to a 22% reduction in GHG emissions by 2030 as compared to 2000 levels. In the revised NDC presented in December 2020, Mexico raised the baseline against which the GHG emission reduction is measured. Greenpeace argued that the updated NDC would effectively cause the additional emission of 14 million tons of CO2e; (ii) eliminate the peak of GHG emissions stipulated for 2026; (iii) rule out the 50% reduction target for 2050, which would nullify the mitigation horizon in the medium and long term. Greenpeace asked the court to suspend the effects of the 2020 NDC.",Whether Mexico’s revised NDC violated human rights law for being regressive.,"https://climatecasechart.com/wp-content/uploads/non-us-case-documents/2021/20210716_15002_decision.pdf, https://climatecasechart.com/wp-content/uploads/non-us-case-documents/2021/20210921_15002_decision.pdf, https://climatecasechart.com/wp-content/uploads/non-us-case-documents/2022/20221215_15002_decision.pdf",https://climatecasechart.com/non-us-case/greenpeace-v-instituto-nacional-de-ecologia-y-cambio-climatico-and-others
