label,year,reporter_info,status,case_categories,jurisdictions,principal_laws,summary,at_issue,case_documents,url
"Borealis Polyolefine GmbH v. Minister for Land, Forestry, Environment, and Water Management",,[2016] C-191-14,Claims denied but corrections factor remanded,"Suits against governments, GHG emissions reduction and trading, EU ETS","European Union, European Court of Justice","European Union, Secondary Law, Directives, 2003/87/EC","This European Court of Justice rejected arguments from three industrial firms—one German, one Dutch, and one Italian—that they should be granted a larger number of free greenhouse gas emissions allowances under the European Union’s greenhouse gas Emissions Trading Scheme (ETS). The Court also instructed the European Commission to revise its approach to determining how many free allowances to grant—a step that has injected uncertainty into the markets built on the ETS. Several features of the ETS are critical to the case:","Challenge to legal validity of ""correction factor"" calculation for emissions allowances",https://climatecasechart.com/wp-content/uploads/non-us-case-documents/2016/20160428_2016-C-191-14_judgment.pdf,https://climatecasechart.com/non-us-case/borealis-polyolefine-gmbh-v-minister-for-land-forestry-environment-and-water-management
"Neubauer, et al. v. Germany",2020,,Decided,"Suits against governments, GHG emissions reduction and trading, Other","Germany, Federal Constitutional Court","Germany, Constitution, Germany, Federal Climate Protection Act of 2019 (KSG)","In February 2020, a group of German youth filed a legal challenge to Germany's Federal Climate Protection Act (“Bundesklimaschutzgesetz” or “KSG”) in the Federal Constitutional Court, arguing that the KSG's target of reducing GHGs by 55% until 2030 from 1990 levels was insufficient. The complainants alleged that the KSG therefore violated their human rights as protected by the Basic Law, Germany's constitution.",Youth argued that Germany's GHG reduction goals violated human rights.,"https://climatecasechart.com/wp-content/uploads/non-us-case-documents/2020/20200206_11817_complaint-1.pdf, https://climatecasechart.com/wp-content/uploads/non-us-case-documents/2020/20200206_11817_complaint.pdf, https://climatecasechart.com/wp-content/uploads/non-us-case-documents/2021/20210324_11817_order.pdf, https://climatecasechart.com/wp-content/uploads/non-us-case-documents/2021/20210324_11817_order-1.pdf, https://climatecasechart.com/wp-content/uploads/non-us-case-documents/2018/20181122_11817_complaint.pdf, https://climatecasechart.com/wp-content/uploads/non-us-case-documents/2020/20200113_11817_complaint.pdf, https://climatecasechart.com/wp-content/uploads/non-us-case-documents/2020/20200113_11817_complaint-1.pdf",https://climatecasechart.com/non-us-case/neubauer-et-al-v-germany
BOT Elektrownia Bełchatów S.A. and Others v. Commission of the European Communities,,Case T-208/07,Application dismissed,"Suits against governments, GHG emissions reduction and trading, EU ETS","European Union, European Court of Justice","European Union, Secondary Law, Directives, 2003/87/EC",One of several challenges to the Commission of the European Communities’ decision rejecting the Polish Phase II national allocation plan (NAP) for the allocation of GHG emission allowances.  The Court dismissed all actions as inadmissible because the Commission’s decision did not directly and individually affect the Applicants.,Sought annulment of European Commission decision rejecting in part phase II of Poland's National Allocation Plan for emissions allowances,https://climatecasechart.com/wp-content/uploads/non-us-case-documents/2008/20081020_Case-T-20807_order.pdf,https://climatecasechart.com/non-us-case/bot-elektrownia-belchatow-sa-and-others-v-commission-of-the-european-communities
U.S. Steel Košice v. Commission of the European Communities (I and II),,[2007] Case T-489/04; [2007] Case T-27/07; [2008] Case C‑6/08 P,Applications dismissed,"Suits against governments, GHG emissions reduction and trading, EU ETS","European Union, General Court (known as Court of First Instance before 2010)","European Union, Secondary Law, Directives, 2003/87/EC","In Case T-489/04 (“U.S. Steel Kosice I”), applicant U.S. Steel Kosice requested the annulment of a 2006 Commission decision on the Slovak NAP for Phase I of the EU ETS on the grounds that the Slovak Republic had been pressured by the Commission during allegedly non-transparent, bilateral negotiations into reducing the total number of allowances under the NAP.  The court dismissed the application as inadmissible, ruling that the reduction of the total quantity of allowance and the Commission’s decision on the NAP did not individually affect the applicant’s interests.",Annulment of Slovak National Allocation Plan sought,No case documents are available.,https://climatecasechart.com/non-us-case/us-steel-kosice-v-commission-of-the-european-communities-i-and-ii
Leghari v. Federation of Pakistan,2015,(2015) W.P. No. 25501/201,Granted,"Suits against governments, Human Rights, Other, Suits against governments, GHG emissions reduction and trading, Other, Suits against governments, Human Rights, Right to a healthy environment","Pakistan, Punjab, Lahore High Court","Pakistan, National Climate Policy and Framework of 2012","Asghar Leghari, a Pakistani farmer sued the national government for failure to carry out the National Climate Change Policy of 2012 and the Framework for Implementation of Climate Change Policy (2014-2030). Leghari argued that the government should pursue climate mitigation or adaptation efforts, and that the government’s failure to meet its climate change adaptation targets had resulted in immediate impacts on Pakistan’s water, food, and energy security. Such impacts offended his fundamental right to life.",Farmer challenged government for failure to carry out core provisions of 2012 law,"https://climatecasechart.com/wp-content/uploads/non-us-case-documents/2015/20150404_2015-W.P.-No.-25501201_decision.pdf, https://climatecasechart.com/wp-content/uploads/non-us-case-documents/2015/20150414_2015-W.P.-No.-25501201_decision.pdf, https://climatecasechart.com/wp-content/uploads/non-us-case-documents/2018/20180125_2015-W.P.-No.-25501201_judgment.pdf",https://climatecasechart.com/non-us-case/ashgar-leghari-v-federation-of-pakistan
Non-compliance Procedure of Ukraine under the Kyoto Protocol II,2016,CC-2016-1-6/Ukraine/EB,Decided,"Suits against governments, GHG emissions reduction and trading, Kyoto Protocol","United Nations, United Nations Framework Convention on Climate Change","International Law, Kyoto Protocol Compliance Tribunals, Kyoto Protocol, International Law, UNFCCC, Kyoto Protocol","The case arose with regard to Ukraine’s true-up period report after the first commitment period under the Protocol. The first question of implementation was triggered by the late submission of this report, and the inconsistencies between information in the report and the transaction log maintained by the secretariat. The second question was regarding Ukraine’s emission reduction targets. It was found that Ukraine did not retire sufficient units to cover its total greenhouse gas emissions as required under the Kyoto Protocol. Consequently, on 7 September 2016 the enforcement branch determined that Ukraine was not in formal compliance with Article 7 (paragraph 1 in conjunction with paragraph 4) of the Kyoto Protocol. Ukraine was required to submit a compliance implementation plan.",Ukraine’s failure to establish a true-up period report demonstrating compliance with the Kyoto Protocol,"https://climatecasechart.com/wp-content/uploads/non-us-case-documents/2016/20160419_CC-2016-1-6UkraineEB-_na.pdf, https://climatecasechart.com/wp-content/uploads/non-us-case-documents/2016/20160907_CC-2016-1-6UkraineEB-_na.pdf, https://climatecasechart.com/wp-content/uploads/non-us-case-documents/2016/20161206_CC-2016-1-6UkraineEB-_na.pdf, https://climatecasechart.com/wp-content/uploads/non-us-case-documents/2017/20170906_CC-2016-1-6UkraineEB-_na.pdf",https://climatecasechart.com/non-us-case/non-compliance-procedure-of-ukraine-under-the-kyoto-protocol-ii
Mahendra Pandey v. Union of India,2016,Application No. 470/2016,"Decided (July 23, 2015)","Suits against governments, GHG emissions reduction and trading, Other","India, National Green Tribunal","International Law, UNFCCC, National Action Plan on Climate Change, International Law, UNFCCC, Paris Agreement","On July 23, 2015, the NGT directed all states to expeditiously draft their action plans on climate change in according with the Centre’s National Action Plan on Climate Change (NAPCC) and have them approved by the Environment Ministry. Despite this direction, the Delhi state government failed to draft, finalize and implement the State Action Plan on Climate Change on the lines and the spirit of the NAPCC. The applicant, Mahendra Pandey, a scientist, contended that the Delhi government claimed to have formulated a Climate Change Agenda for the national capital in 2009. However, the Agenda expired in 2012 and since then Delhi has no Action Plan on Climate Change.",Formulation and implementation of Delhi climate action plan.,"https://climatecasechart.com/wp-content/uploads/non-us-case-documents/2016/20160901_Application-No.-4702016_complaint.pdf, https://climatecasechart.com/wp-content/uploads/non-us-case-documents/2019/20190102_Application-No.-4702016_decision.pdf, https://climatecasechart.com/wp-content/uploads/non-us-case-documents/2019/20190108_Application-No.-4702016_judgment.pdf",https://climatecasechart.com/non-us-case/mahendra-pandey-v-union-of-india
"Nuestros Derechos al Futuro y Medio Ambiente Sano et. al., v. Mexico (Unconstitutionality of the reform to the Electric Industry Law)",2021,Amparo No. 204/2021,Pending,"Suits against governments, GHG emissions reduction and trading, Other","Mexico, First Circuit Collegiate Tribunal, Mexico, District Court in Administrative Matters","International Law, UNFCCC, Paris Agreement, Mexico, Energy Transition Law, Mexico, Electricity Industry Law, Mexico, General Law on Climate Change, Mexico, Constitution, International Law, Escazú Agreement","On March 24, 2021, five civil associations (Nuestros Derechos al Futuro y Medio Ambiente Sano A.C.; Alianza Juvenil por la Sostenibilidad, A.C.; Naj Hub, A.C.; Consejo Interuniversitario Nacional de Estudiantes de Derecho, A.C.; and Ágora Ciudadanos Cambiando México, A.C.), with the support of the #JóvenesPorNuestroFuturo collective, made up of more than 20 youth groups, filed a lawsuit against the Mexican Congress and the President of Mexico challenging the 2021 amendments of the Electric Industry Law.",Whether the amendment of Mexico’s Electric Industry Law violates the constitutional right to a healthy environment by giving preference to electricity generated by coal and fuel oil-fired power plants over renewables.,"https://climatecasechart.com/wp-content/uploads/non-us-case-documents/2021/20210324_Amparo-No.-2042021_petition-1.pdf, https://climatecasechart.com/wp-content/uploads/non-us-case-documents/2021/20210407_Amparo-No.-2042021_ruling-1.pdf, https://climatecasechart.com/wp-content/uploads/non-us-case-documents/2022/20221223_Amparo-No.-2042021_decision.pdf",https://climatecasechart.com/non-us-case/nuestros-derechos-al-futuro-y-medio-ambiente-sano-et-al-v-mexico-unconstitutionality-of-the-reform-to-the-electric-industry-law
Société Arcelor Atlantique et Lorraine v. Premier Minister,,[2008] Case C-127/07 (Grand Chamber),French law upheld,"Suits against governments, GHG emissions reduction and trading, EU ETS","European Union, European Court of Justice","European Union, Secondary Law, Directives, 2003/87/EC","The European Court of Justice upheld provisions of Directive 2003/87 implemented by French legislation, which applied the greenhouse gas trading scheme to installations in the steel sector.  Arcelor, a worldwide steel enterprise, challenged the directive under the principle of equality.  Arcelor argued that non-ferrous metals and plastics are both industries emitting greenhouse gases, yet they are not regulated by the Directive.  The Court found the differences in treatment between the steel industry and the chemical and non-ferrous metal industries to be justified based on substantial differences among the industries, such as the number of installations and the levels of direct emissions.",Challenge to the directive under the principle of equality,https://climatecasechart.com/wp-content/uploads/non-us-case-documents/2008/20081216_2008-Case-C-12707-Grand-Chamber_judgment-1.pdf,https://climatecasechart.com/non-us-case/societe-arcelor-atlantique-et-lorraine-v-premier-minister
Republic of Estonia v. Commission of the European Communities,,Case T-263/07,Reversed European Commission's decision,"Suits against governments, GHG emissions reduction and trading, EU ETS","European Union, General Court (known as Court of First Instance before 2010)","European Union, Secondary Law, Directives, 2003/87/EC","In 2006, the Republic of Estonia notified the Commission of its NAP for the period from 2008 to 2012.  In 2007, the Commission held that its NAP was incompatible with the criteria set forth in Directive 2003/87 and decided that the total annual quantities of emission allowances should be reduced to 47.8% less than that proposed.  Estonia appealed the Commission’s decision.  As a preliminary issue, the Court held that each member state is to decide, on the basis of its NAP, on the total quantity of allowances it will allocate for a period in question, and the Commission’s power to review these NAPs is very restricted. The Court held that the Commission did not properly examine the NAP and infringed on the principle of sound administration.","Challenge to Commission’s decision, which held that Estonia’s NAP was inconsistent with Directive 2003/87",https://climatecasechart.com/wp-content/uploads/non-us-case-documents/2009/20090923_Case-T-26307_judgment.pdf,https://climatecasechart.com/non-us-case/republic-of-estonia-v-commission-of-the-european-communities
Non-compliance Procedure of Monaco under the Kyoto Protocol,2018,CC-2018-1/Monaco/EB,Decided,"Suits against governments, GHG emissions reduction and trading, Kyoto Protocol","United Nations, United Nations Framework Convention on Climate Change","International Law, Kyoto Protocol Compliance Tribunals, Kyoto Protocol, International Law, UNFCCC, Kyoto Protocol",The question of implementation arose with respect to Monaco’s annual submission made in 2017. The expert review team (ERT) noted that there were significant delays in the submission of annual inventory reports (NIRs) meaning Monaco had not met mandatory requirements and furthermore considered that the late submission of NIRs indicates problems with the performance of the national system functions.,Monaco’s non-compliance with Articles 5 and 7 of the Kyoto Protocol in relation to its annual submission.,"https://climatecasechart.com/wp-content/uploads/non-us-case-documents/2018/20180323_CC-2018-1MonacoEB_na.pdf, https://climatecasechart.com/wp-content/uploads/non-us-case-documents/2018/20180830_CC-2018-1MonacoEB_na.pdf, https://climatecasechart.com/wp-content/uploads/non-us-case-documents/2018/20181014_CC-2018-1MonacoEB_na.pdf, https://climatecasechart.com/wp-content/uploads/non-us-case-documents/2018/20181109_CC-2018-1MonacoEB_na.pdf",https://climatecasechart.com/non-us-case/non-compliance-procedure-of-monaco-under-the-kyoto-protocol
Ruling on the constitutionality of state “green taxes” in Zacatecas,2017,Amparo en Revisión 888/2018,Decided,"Suits against governments, GHG emissions reduction and trading, Other","Mexico, Supreme Court","Mexico, Constitution","On December 31, 2016, the State of Zacatecas, Mexico published its 2017 Treasury Bill, Expenditure Bill and Revenue Bill. The Treasury Bill established a tax on greenhouse gas emissions (GHG) produced by stationary sources.  A corporation dedicated to beer production sued the state legislature, challenging the constitutionality of the Treasury Bill of the State of Zacatecas. Specifically, the corporation argued that the State of Zacatecas was invading the national Congress’s powers by introducing the tax. On October 31, 2017, the Second District Judge in the State of Zacatecas agreed that state authorities could not tax GHG emissions without overstepping on Congress’s power. Particularly, the judge pointed to the fact that the Mexican Constitution reserves imposition of taxes on beers to federal authorities. Thus, it declared the taxes unconstitutional. State authorities appealed the decision to the appellate Collegiate Tribunal, and the Collegiate Tribunal sent the case to the Supreme Court for review.",Whether a tax on GHG emissions instituted by the State of Zacatecas was unconstitutional.,https://climatecasechart.com/wp-content/uploads/non-us-case-documents/2020/20200206_Amparo-en-Revision-8882018_decision.pdf,https://climatecasechart.com/non-us-case/ruling-on-the-constitutionality-of-state-green-taxes-in-zacatecas
Republic of Poland v. European Commission [ECJ 2013],,[2013] Case T-370/11,Application dismissed,"Suits against governments, GHG emissions reduction and trading, EU ETS","European Union, European Court of Justice","European Union, Secondary Law, Directives, 2003/87/EC","Challenge brought by Poland against Directive 2003/87/EC establishing a scheme for greenhouse gas emission allowance trading within the Community. In support of the action, the Republic of Poland raised four pleas. The first alleged an infringement of the TFEU on the ground that the Commission did not take into account the specificity of each Member State in respect of fuel. The second plea concerned an alleged breach of the principle of equal treatment on the ground that the Commission did not take into account the difference in situation between the regions of the European Union. The third plea alleged a breach of the principle of proportionality. The fourth plea alleged that the Commission was not competent to adopt the contested decision. The General Court rejected all four grounds and the action was therefore dismissed. In particular, the General Court held that “the determination by the Commission of the heat and fuel benchmarks by using the reference performance of natural gas may be regarded as objectively justified” (para. 58).",Challenge against  scheme for greenhouse gas emission allowance trading within the Community,https://climatecasechart.com/wp-content/uploads/non-us-case-documents/2013/20130307_2013-Case-T-37011_judgment-1.pdf,https://climatecasechart.com/non-us-case/republic-of-poland-v-european-commission-ecj-2013
External Contribution to the French Constitutional Council,2019,Not available,Pending,"Suits against governments, GHG emissions reduction and trading, Other","France, Constitutional Council","France, Constitution","On September 26, 2019, the French Parliament approved a bill related to energy and the climate, which aims to achieve carbon neutrality by 2050.  The environmental nongovernmental organization Notre Affaire à Tous (NAAT) filed an external contribution (similar to a friend of the court filing) with the French Constitutional Council, which according to NAAT is reviewing the new legislation following a legal challenge.  NAAT alleges that the bill does not comply with the environmental obligation of vigilance previously recognized by the Constitutional Council, and asks the Council to recognize the right to live in a sustainable climate as a constitutional principle.","Environmental group filed memorandum asking French Constitutional Council to invalidate the French Parliament's adoption of an energy and climate bill, alleging that the measures provided are insufficient to achieve carbon neutrality by 2050.",https://climatecasechart.com/wp-content/uploads/non-us-case-documents/2019/20191015_Not-available_na.pdf,https://climatecasechart.com/non-us-case/external-contribution-to-the-french-constitutional-council
Associação Último Recurso et al. v. Portuguese State,2023,,Pending,,"Portugal, Lisbon Civil Court","Portugal, Articles 22, International Law, UNFCCC, Paris Agreement, Portugal, 26 and 66 of the Portuguese Constitution (State’s civil liability, Portugal, right to life, Portugal, and right to a healthy environment), European Union, Regulation EU/2021/1999, Portugal, Articles 2 and 8 of the ECHR (right to life and right to private and family life and to enjoy one’s domicile), Portugal, Portuguese Climate Framework Law, European Union, of 30 June 2021","On November 26, 2023, three NGOs (Associação Último Recurso, Quercus and Sciaena) filed a complaint against the Portuguese State, pursuant to the Portuguese Class Action Statute (i.e., Law no. 83/95, of August 31, 1995).
They invoke that the Portuguese State adopted in 2021 a Climate Framework Law (i.e., Law no. 98/2021, of 31 December 2021), according to which the Portuguese State, until February 1, 2023, had an obligation to adopt several measures (including to enact laws and other political acts) aimed at achieving the GHG emissions reduction goal of 55% until 2030, in comparison with the emissions values of 2005.
These measures include the adoption of the carbon budgets for 2023/2025 and 2025/2030; a report of assessment of climate impact of the legislation in force; the regulation of the climate risk and impact of financial products; an amendment to the rules in relation to corporate governance; an amendment to the legal regime on the exploration for, and exploitation of, hydrocarbons. Moreover, the plaintiffs claim that other deadlines until the end of 2023 and early 2024 are likely to be failed.
Accordingly, the plaintiffs ask the court (1) to declare that the Portuguese State has not complied with its obligations pursuant to the Portuguese Climate Framework Law, which realizes the human and fundamental rights listed in the Constitution and in the ECHR, and implements the Portuguese NDC submitted under the Paris Agreement; and (2) to require the State to adopt the laws and political acts necessary to comply with the Climate Framework Law.
On April 11, 2024, the court of first instance dismissed the proceedings. The plaintiffs appealed.","Whether the Portuguese legislator has failed to implement the measures (laws and political acts) listed, and binding, in the Portuguese Climate Framework Law.

On appeal: Whether the applicant's request was generic (and thus inadmissible); and, if so, whether the applicant could submit a new request.","https://climatecasechart.com/wp-content/uploads/non-us-case-documents/2023/20231126_22315_petition.pdf, https://climatecasechart.com/wp-content/uploads/non-us-case-documents/2024/20240411_22315_decision.pdf, https://climatecasechart.com/wp-content/uploads/non-us-case-documents/2024/20240411_22315_decision-2.pdf, https://climatecasechart.com/wp-content/uploads/non-us-case-documents/2024/20240919_22315_decision.pdf",https://climatecasechart.com/non-us-case/associacao-ultimo-recurso-et-al-v-portuguese-state
Green Network SpA v. Italian Electric & Gas Authority,,[2014] C-66/13,Domestic law precluded,"Suits against governments, GHG emissions reduction and trading, EU ETS","European Union, European Court of Justice","European Union, Secondary Law, Directives, 2001/77/EC, European Union, Secondary Law, Directives, 2009/28/EC","An Italian company, Green Network SpA (“Green Network”), imported renewable energy from a Swiss supplier in 2005. Under Italian law, energy companies were required to purchase a certain number of green certificates each year, but could seek an exemption where they imported renewable energy from countries with analogous laws promoting renewable energy. Where the exporting country was not a member of the European Union, the exemption was available only if there was a prior agreement between the importing and exporting countries regarding recognition of guarantees of origin. When Green Network requested an exemption from its obligation to purchase green certificates, the Italian national grid manager rejected that request since there was no agreement regarding guarantees of origin between Italy and Switzerland at the time the renewable energy was imported. Green Network brought an action in administrative court, which was dismissed. Green Network appealed the dismissal, and the appeals court referred to the European Court of Justice the question, inter alia, whether the Italian law conflicted with EU directives. The Court held that the Italian law was precluded since guarantees of origin fall within an area largely covered by EU law.",Question referred from appeals court regarding whether Italian law at issue was precluded by EU law,https://climatecasechart.com/wp-content/uploads/non-us-case-documents/2014/20141115_2014-C-6613_judgment.pdf,https://climatecasechart.com/non-us-case/green-network-spa-v-italian-electric-gas-authority
Álvarez et al v. Peru,2019,,Pending,"Suits against governments, GHG emissions reduction and trading, Other","Peru, Superior Court of Lima","Peru, Constitution of Peru","On December 16, 2019, a group of Peruvian youth filed suit against Peru, alleging that the government has taken insufficient action to address climate change.",Peruvian youth sued Peru to require net zero deforestation in the Amazon by 2025.,"https://climatecasechart.com/wp-content/uploads/non-us-case-documents/2019/20191216_NA_complaint.pdf, https://climatecasechart.com/wp-content/uploads/non-us-case-documents/2019/20191201_NA_na.pdf",https://climatecasechart.com/non-us-case/alvarez-et-al-v-peru
